0x0046: 0x63
0xf21b: 0x0c
0x0150: 0x34
0x003c: 0x01
0xf999: 0x00
0xf27c: 0x05, 0x07
0xf2a6: 0x01, 0x02
0x005e: 0x01
0x00c7: 0x00
0x0043: 0x00, 0x00
0x00c1: 0x00
0x00af: 0x98
0xf279: 0x7f
0xf10e: 0xea, 0x3f, 0x01, 0x00, 0xac, 0x00, 0x01,
0x00a7: 0xff
0xf02b: 0x01
0xfd37: 0x00
0x01a4: 0x00
0x01a4: 0x00
p_err: 5122, p_bit: 16320000, abort: 73
s_dbm: -47
.................................................................................
0x0046: 0x63
0xf21b: 0x0c
0x0150: 0x34
0x003c: 0x01
0xf999: 0x01
0xf27c: 0x05, 0x07
0xf2a6: 0x01, 0x02
0x005e: 0x01
0x00c7: 0x00
0x0043: 0x00, 0x00
0x00c1: 0x00
0x00af: 0x9a
0xf279: 0x7f
0xf10e: 0xea, 0x3f, 0x01, 0x00, 0xac, 0x00, 0x01,
0x00a7: 0xff
0xf02b: 0x00
0xfd37: 0x00
0x01a4: 0x00
0x01a4: 0x00
p_err: 1438, p_bit: 16320000, abort: 22
s_dbm: -46
.................................................................................
0x0046: 0x63
0xf21b: 0x0c
0x0150: 0x36
0x003c: 0x01
0xf999: 0x01
0xf27c: 0x05, 0x06
0xf2a6: 0x01, 0x02
0x005e: 0x01
0x00c7: 0x00
0x0043: 0x00, 0x00
0x00c1: 0x00
0x00af: 0x18
0xf279: 0x61
0xf10e: 0xea, 0x3f, 0x01, 0x00, 0xac, 0x00, 0x01,
0x00a7: 0xff
0xf02b: 0x01
0xfd37: 0x00
0x01a4: 0x00
0x01a4: 0x00
p_err: 1530, p_bit: 16320000, abort: 22
s_dbm: -44
.................................................................................



